pagina,opinion,estrellas,n_words
1,"no se el libro no es para mi así que no lo he leído.pero voy a valorar físicamente al libro, es pequeñito como de 15 cm y tiene una letra adecuada, luego las pg de papel no cortan ya que no son rígidas. Lo que molesta un poco sobretodo si lo quieres regalar es que ponga el precio según aparee en la foto (arriba a la derecha) pero bueno se pone una pegatina y solucionado",4,74
1,"Los personajes son de lo más simples: Un chica tímida, que es guapa pero no lo sabe y un ricachón guaperas con un pasado oscuro. El escenario no puede ser más perfecto. Él se enamora de ella, la primera vez que se enamora después de haberse acostado con decenas de chicas... Le hace regalos carísimos, tienen una química increíble. Y pasa lo de siempre, ella es tan perfecta que él cree que no se la merece. Un cuento de hadas moderno, ni siquiera las escenas más eróticas me interesaron demasiado. Si estás acostumbrado a leer y aprecias la literatura, no lo recomiendo.",2,101
1,"Un libro ameno que se lee muy fácilmente. No obstante, la historia deja mucho que desear y los personajes son planos hasta decir basta y muestran un reflejo de la frivolidad y los caprichos del mundo en el que vivimos. Si al menos, esto se hubiera aprovechado para ser una crítica social estaríamos hablando de un libro completamente diferente.",2,58
2,"Tenía curiosidad por leer el éxito literario del momento, todo el mundo lo está leyendo... Tengo que admitir que engancha, se lee muy fácilmente, pero la historia no tiene interés, ni los personajes profundidad, por no hablar del decepcionante estilo literario.Se lo recomendaría a quien quiera leer muchísimas escenas eróticas, demasiadas diría yo, y a quien quiera poder opinar sobre lo que lee todo el mundo.",2,65
2,"Se lo regalé a mi mujer el día de los enamorados , y en tres días lo terminó de leer entero , eso sí , estaba todo el día leyendo , y os juro que mo es persona de leer , pero según ella , la cautivó y no podía dejar de leerlo .",5,53
2,"Últimamente y para la época estival se nos presentan productos tipo ""ladrillo"" que para quedar más "" enganchados"" nos los presentan por trilogías. Deberían hacer un descuento y así tal vez vendian todas las partes. Tras leer esta que es un folletín rosa de lujo y personajes VIPs pensé en no alargar lectura en segunda y tercera parte , pues con esta primera ya se ha dado todo lo que se podía. En todo caso.... , el tiempo dirá.",2,78
3,"Creí que iba a ser más profundo, me esperaba otra cosa, demasiada publicidad. Es entretenido, pero quitando las experiencias sexuales que queda ¿nada?. Un libro para pasar el rato pero sin esperar demasiado a cambio. No me voy a comprar los siguientes, serán más de lo mismo. Se lo recomiendo a quien solo quiera pasar el tiempo, si buscas algo que te haga reflexionar o una lectura en profundidad, este no es tu libro.",3,73
